{
  "solicitud_id": "SYN-INT001-0001",
  "texto_formulario": "Hola, me llamo Ana Pérez. Quiero el curso de liderazgo comunitario. Mi correo es ana.perez.sintetica@mail.test y mi teléfono +56 9 1111 0001.",
  "programa_ref": "formacion/liderazgo-comunitario",
  "locale": "es-CL",
  "clasificacion_datos": "sintetica"
}
